text,label,subreddit,parent_comment
"I'm not sure I agree but I'll give you an upvote for a damned decent argument (civilly made, that's a rarity on this site, hah) and actually having thought about the incident in question a bit before commenting.",0,offbeat,"I disagree. Offbeat until the truth gets out. One side claims deputies out of control, the Sheriff isn't claiming much, yet. But they say they have both dash cams and body cams, which have been turned over to the state police. Importantly, it was suggested that the deputies are locals, and understand ranching, which would make their behavior bizarre. Even the shooting doesn't make sense. The rancher was supposedly about to shoot his bull, when a deputy spun him around and shot him in the stomach. But *then* he was shot three or four times in the chest, which makes no sense as the normal response to being shot in the stomach is to double over."
Hillary is a douche *too*.,0,PublicFreakout,"Only douchebags comment on what others drive. What if I told you that Hillary drives an Audi, would you change your mind then?"
I think the reason you act like this is because your parents were monsters.,0,todayilearned,"nah, lifes pretty good. i live in a nigger free neighborhood. im very thankful."
Full meta now.,0,funny,Funny because that is Lee Circle in New Orleans.
I personally agree with you.,0,Anarcho_Capitalism,"Market based systems of property rights are bound to have the least violence. It's not ideal, but ideal isn't achievable anyway."
Going on exchange!,0,AskReddit,"Reddit, what is the most exciting thing you are doing this summer?"
I think it'll work of you disable the stock clock app.,0,androidapps,Timely alarm app I'm hoping you guys can help me. I downloaded the app in hopes to replaces the stock clock app on my pixel. Love the app but it doesn't work with Google now. Is there something special I need to do? I'm kinda lost at this point. I've emailed the devs and they aren't responding. Is the app even going to ever be updated again? How do I find out?
I think you're dumb ass comment gave me ebola,0,news,No that's not how it should be. And they and we can squarely blame Obola for this. Duncan should never have been able to travel here. Period. Ebama has blood on his hands here.
"Are you kidding me, they're like every other Draugr I see now.",0,skyrim,I felt this way when I first encountered a Hulking Draugr. I've still only ever seen one. They're like unicorns.
DEE REYNOLDS,0,gifs,#FLIGHTLESS BIRDS
Still better than the finale!,0,PrettyLittleLiars,"Two NFL Players Reenact a Scene from ""Pretty Little Liars"" on Jimmy Fallon"
Something between pity and frustration,0,atheism,"As an athiest, how would you describe your primary emotion toward the believers you do not agree with? (Rage, Angrer, frustration, sorry for, pity, compassion, etc.). My goal is compassion, but I have to say I also feel angry at times, frustrated, etc. Believe me when I tell you I know where believers are coming from. Ministry was my education through bachelor's degree. Bottom dropped out of my belief my senior year (thanks god), and I've been waking more and more up every day since. Jeeze, that's been 32 years now."
"All these berries brought to you by, shari's berries.",0,Jokes,What do you call a strawberry? A strawberry.
Ayyy I live in Jersey too I don't really like it where I am tho it's so boring,0,teenagers,new jersey!
I like turtles.,0,Smite,Why are you here?
"I'm an only child, so not having to share my shit with a sibling is my fondest memory.",0,AskReddit,What's the fondest memory you have with your sibling while growing up?
I loved wet work just so I could use the night vision.,0,Cod4Remastered,"Countdown is the shit, also Pipeline and basically all 6 maps except Wet Work"
"Nah, I checked, that's not it.",0,videos,Darude sandstorm
Embrace that which you fear the most!,0,darkestdungeon,Law of Conservation of Darkest Dungeon
"The drum part looks so fun to play, good job man!",0,Drumming,I like playing the drums. It calms my soul. Here's a song my brother and I made. What do you think?
What are you even using a table knife for there?,0,mildlyinfuriating,When this shit happens.
Clevergirl - a girl who has all the powers and abilities of clever.,0,gifs,Clever girl
And fuck her too.,0,pics,fuck you
NBK was the best support in world when playing that role,0,GlobalOffensive,"Doesn't make sense. What's the point of having 2 entry fraggers? You need a solid role player. bodyy isn't one, and with him in the team, they wouldn't have one at all."
^ Never ask this guy for directions.,0,funny,"The ladies love it, trust me!"
There's not really anything wrong with getting with your cousin.,0,CringeAnarchy,Redneck Love Story
I wonder what the next weekly will be.,0,blackops3,July 10 daily contract The contract for today is: **Assault Rifles** Get 100 kills using Assault Rifles.
The last season was terrible.,0,scifi,"Why was J.J Abram's Fringe so looked down upon? So I've recently started the second season of Fringe and it's awesome! Y'know, the conspiracy leads in the story, the theories and the greatness from the Fringe division of science. Yet, critics weren't responding completely positive about the show, calling it ""X-Files wannabe"". Which is kinda true but I honestly enjoyed and still enjoying it mor than X Files or Alias for e.g So what do you think about Fringe? Did you actually follow Abram throughout this 5 seasons work of his or did you just stop till a certain point? P.S: Speaking of J.J, so excited for his contribution in a Half-life and Portal movies, the really good videogame based movies are barely countable, and I feel that Valve is putting its products in safe hands."
I like no fucks Obama because Lindsey has the charisma of a cardboard box.,0,hillaryclinton,"Based Lindsey. I'm not sure who I like more, No Fucks Lindsey or No Fucks Obama"
"They're against ILLEGAL immigration, they migrated legally",0,news,"So they think the world sends the lowest of the low to the US? Do they like being called the ""worst""?"
Its a course in Scientology philosophy indoctrination.,0,entertainment,"He has claimed he isn't multiple times. The school he donates to teaches Study Tech, which is a course on teaching kids how to learn effectively, it doesn't necessarily mean they teach you Scientology in it, the school has denied that it teaches the religion. If he is a Scientologist why does he deny it."
Unfortunately Turkey will try to block it at every turn.,0,Military,Independent Kurdistan would be America's best ally for regional stability. The Kurds have always been reasonable and willing to work with us.
Well first of all I guess I don't dream about getting fucked by firemen,0,WTF,"You seriously don't think that's hot? Like, a big sweaty fireman carries you out of a burning building, lays you on the sidewalk, and you think, ""Yeah, okay, he's gonna give me mouth to mouth."" But instead, he just starts choking the shit out of you, and the last sensation that you feel before you die is he is squeezing your throat so hard that a big, wet, blob of drool drips off his teeth and just ""flurr"", falls right onto your popped out eyeball..."
Quality vs quantity is a telling thing when it come to the taxidermy a man keeps.,0,WTF,"I'm a hunter, and like most hunters we don't take trophies. We're far more interested in the hunt itself, and the yummy goodies you get to take home, cook, and eat in the months to come. I know very few people who mount heads on their wall, other than the ""holy shit!"" kills that no one would believe if said head weren't mounted on the wall."
That's amazing.,0,cumsluts,Ariel Rebel (Album)
because part of the contract we sign with the insurance company states that we cannot charge more to patients with insurance.,0,Dentistry,"How much are they docking you? I'll tell you what..If I knew way back when what I know now I would have never opted for it. Example. Dentist near my work with insurance resin composite 1 surface is $165 Without insurance another equally skilled dentist charges $120. More expensive dentist in my view is charging more to then make it look like it comes down a bit once my ""insurance"" settles part of it..But in the end it averages out..Difference is no insurance cash patient wouldn't have been spending 25-30 a month x 12..I'd have an extra $360 a year to put towards dental treatment costs. Example treatment from a few years back. $1270 total..Insurance picked up a few hundred and I paid balance of $800...The year of insurance cost me $360 so really I'ts like $1160 for a net savings of a whopping $110 This other dentist cash with same everything would have been $870 without me shelling out the $360/year.. I get that dentists have to jump through hoops and that might make them charge more but why not be honest about it? Why not say..""hey..Insurance sucks..I charge more with insurance because it is not fun to deal with..Why don't you dump your insurance and we'll work out something on a cash basis"""
"Whatever cunt, maybe if you laid off the darts a bit and stopped buying that second sausage roll from the food van at smoko, you might have the lung strength to pull it.",0,straya,Oii cunt get fucked maxi's are heaps shit for billies. Get no fuckin pull at all. Outrageous
For pageantry scene taught her well.,0,rupaulsdragrace,God Naysha is so charismatic! She answers everything with such poise and elegance. She's also a great interviewee. From what I've seen she always turns simple questions into elaborate answers. Love her
talking so much shit about my pumpkin at the barbershop they forget their hair cut,0,Kanye,"Fuckers in school telling me, always at the barbershop, Im cringing about this, Im cringing about that, I always be cringing at work... SHUT THE FUCK UP......YALL KNOW ITS ONLY YOU THAT BE CRINGING AT THEM."
IT-Crowd &lt;3,0,harrypotter,"No, you gotta dial the new number now it's just 0118 999 881 99 9119 725 3."
"Hermione is mentioned as ""turning pink"" when she's embarrassed, too.",0,harrypotter,"This is the kind of evidence I'm interested in when J.K. says she never specified. Yeah, she never said, ""Caucasian Hermione strolled down the hall"", but aren't there some implications?"
"Yes, the car models are modded, but all of the cars seen are players that have been recorded and overlayed on the same replay.",0,combinedgifs,"Is this modded TM2V? I have never seen that big truck as a driveable car and neither Porsches, Mercedes and moving AI cars (in the parking lot). Also havent played it in ages."
shut up,0,nfl,"If you think comparing yourself to an NFL reporter is going to prove your point, you're pretty mistaken. Good luck with that though."
That's literally one of the main points/aspects of the show.,0,girls,Racial diversity is one thing... What about economic diversity? Everybody on the show gets a hand out from relatives.
if you press R again it will start to return to you,0,leagueoflegends,Can you short-cast Draven's ultimate?
We need a Breitbart News Network.,0,The_Donald,I've been watching as well. So sad. They're giving BSNBC a run for their money. Fuck em
"when you're good, you're good, but when you're bad, you get a serious STD",0,rupaulsdragrace,He should come up here and fuck me in he ass hole
Hit it in the shower,0,AdviceAnimals,"My wife has to get up at 5:30 to get ready for work, while I'm a work-from-home programmer who can set my own hours. So what do I do? I get up at 5:30 and make coffee and we spend a few minutes together talking and drinking coffee before she hits the shower. It's nice."
Worst case ontario,0,AskReddit,"Upvote for ""Intents and purposes"" and not intensive purposes"
"You mean aluminium plates cutting through the train, killing three people, injuring lots and chopping the train drivers leg off.",0,WTF,Not to mention pieces of the trailer splintering through the windows of the train.
"Okay, statistics can help tell a story if they are used correctly and given proper context.",0,SubredditDrama,"Statistics never ""tell a story."" It can imply correlation, but you have to search out the story for yourself."
"I believe this is a move called ""unsupermaning""",0,WTF,SUPLEX!
Is that Sookie?,0,TrollXChromosomes,HIFW the guy I just started seeing is a foot taller than I am and tallness is my catnip.
Preorder cancelled.,0,NoMansSkyTheGame,Literally Unplayable!
*It takes a village...*,0,leagueoflegends,"It's not Riot's job to correct player behavior, just remove poor behavior from the community that has good behavior. Let the parents decide how to make their child less of an asshole."
"What was odd to me initially (but no longer, given I have more of an understanding of the trans movement now) is how long we've had to fight for equal rights for gays, yet trans people have been granted special privileges seemingly over night.",0,Gender_Critical,Isn't it insane how our culture veered so hard towards this?
They have an inner peace you are psychologically incapable of acheiving.,0,AskReddit,Why do animals stare blankly at nothing?
"To that article author... Fuck you, fuck your boring life and most of all, fuck losing myself to being the parent of a crotch-dumpling...",0,childfree,This made my soul shrivel. Posted by a person mom.
"So I can kill someone for their 123 cr bounty, but I can't take the 4 tons of grain they left behind?",0,EliteDangerous,"Because you didn't buy them! You're getting something for nothing, the risk is you could be scanned when you're taking it in to sell. I think it's fair enough."
With sand.,0,funny,"""You're filling my heart!"""
"Their cover of No Quarter is amazing, and Lateralus has brought me to tears before.",0,AskReddit,I highly recommend Tool.
Rick and Morty and here come the downvotes because i answered a question honestly,0,television,"What current TV series genuinely confuses you as to why it's popular? (Excluding reality TV) Question in the title, what show baffles you as to why its so popular."
If your SR could only go up then everybody would be grandmaster with enough playtime,0,Overwatch,That is kind of the point. Maybe set it so you only get half the gain you would for a normal match. There is literally no reason to backfill knowing you could be walking into a match that you are 5 seconds away from losing.
Alternatively you could leave a bottle of water on the shelf next to the meds for a while and then explain that they now have roughly the same amount of medication.,0,AskReddit,Very tempting...I'm actually going to consider this.
That's some Jeffery Dahmer type shit,0,nfl,That's uh... that's a bit excessive. I like you.
"He's not going to college, but places.",0,rage,You're going places in life.
"They didn't plan anything, Randy was told when he got to the building.",0,SquaredCircle,"Yup, if they're planning on having such a controversial ending, the creative NEED to have a decent plan for what happens afterwards. Such a bizarre way to end such a hyped up match and they kind of played it off as if it was a typical ending."
The Cowboys...uh....find a way.,0,cowboys,Posts hating Weeden. Posts defending Weeden. Posts calling for Cassel. Posts hating Cassel. Posts defending Cassel. God creates dinosaurs. God destroys dinosaurs. God creates man. Man destroys God. Man creates dinosaurs.
They played forest no?,0,ElectricForest,Yeah I just wish they'd come near the Midwest for once lol
"6700k is 126mm^2 with igpu taking 1/3 of the die, 6900k is 250mm^2 with no igpu.",0,Amd,"Would removing the Igpus considerably decrease the processors prices? Just that, current skylake processors have very good integrated graphics (not like they can handle 1080/60 but they do very well for what they are), so, if we talk about Ryzen/Kaby. Removing the Igpus, or making it extremelly basic (for example, to be able to at least use the PC if something happens to your graphics card) would decrease the price considerably? Because if you think about it, there's a lot of people that doesnt use the processors for gaming or heavy graphics work, or also that have discrete graphic cards. This could be a good save for that people?"
"Those t-amp's are awesome, titan's are great to run with too.",0,diyaudio,"You know what? I had a T-Amp that I modded and I ran the thing of a 30 dollar lawnmower battery I picked up at Walmart. I used it to run some Paradigm Titans. That battery powered the amp for about 5 months of very heavy use. If you've got some relatively sensitive speakers, I'd say, go for it. it's a fun project and you'll surprise yourself at how long the battery will last."
riding the rift could be a lucrative term,0,oculus,"Fine just call it Super Karate Monkey Death Car, at least that sounds fun, rift does not. Unless your part of some unwashed mass with whose first contact of the word rift was via the Oculus, there is no tangible connection to the product. All the branding and stories written focus on the word Oculus, why throw that recognition away."
Co Main Event and Heavy Hands,0,MMA,MMA Podcasts? Can anyone recommend good MMA podcasts? I've been listening to Heavy Hands and the MMA Hour for a while now (love them) but I'm looking for more. I've also checked out MMA Nuts but was not wowed by the content. Thanks!
Can you give me an example of how it works?,0,Teachers,Taboo definitely promotes the higher level thinking then. I strongly suggest trying it.
"Until you OD on pills and wine, sure.",0,AskReddit,But those sweet sweet alimony/child support checks
I have a dollar on ANX because of the 2000:1 odds they win.,0,leagueoflegends,If the worlds finals are INT - NOX I will be stunned beyond words.
*googles suppressor cutaway view*,0,guns,You gotta wurk here to see this part
Maybe they did,0,politics,Hillary Clinton: Aliens May Have Visited Us
ayy lmao same,0,MaymayZone,mate make me mod and I swear 2 god I literally wont do anything I promise
Hey I tagged you as today being your birthday so happy birthday,0,hockey,What does this have to do with Dolan?
At least you didn't make the top socially awesome penguin.,0,AdviceAnimals,Happens more often than I would like to admit
There's probably an instant shutoff to it.,0,engineteststands,"So if the anchoring were to break with this thing on a maintenance cart, that would be bad, right?"
This kills the business.,0,worldnews,This is a common mistake when dealing with the government
I know that feel :(,0,nba,"John wall is definitely a top 5 PG when it comes to defense, and it doesn't hurt that the Wiz have maintained a top 5 defense this season. (Top 10 in the 2 before this one) The wizards are a great defensive team, it's just our offensive schemes that make you shake your head."
No it's called ''ordinateur portable'' or in short ''ordi''.,0,funny,Is that what they call a laptop in France?
I can't wait to see what the trans-ethnic demisaurusexual trichromatic toaster kin tards on tumblr will do with this.,0,army,The Israeli Army Unit That Recruits Teens With Autism
Cabanerena,0,Warthunder,Carbonara?
I'm so sorry but it's probably better to find out now rather than later.,0,TwoXChromosomes,"We've been together for over 3 years. before this, I honestly thought we would spend the rest of our lives together. I knew he had extreme beliefs but not this extreme. the more I think about it, the more i realize just how shitty he was and I dont want to be around him anymore. I feel sick when i think about what he said to me"
"You probably already figured this out, but no.",0,iOSProgramming,"There are quick actions on the home screen, but can you display any other content when someone force touches the icon?"
"I don't know, but I've seen seeds and tuna cans spawn at buildings tagged as abandoned.",0,dayz,"Does the ""Abandoned"" loot-group just mean that there isn't anything at all spawning at these places or that there is just not a lot and very basic loot spawning there?"
I don't have that perk but can still do it.,0,Fallout,Pretty sure it is included for the Vans perk
"I don't really see why, but if you want to upload a video of your module, feel free to do so.",0,KerbalSpaceProgram,Would each section of building the station be put on YouTube?
"Well, if they brought seasons to consoles I wouldn't need to switch in the first place.",0,D3PS4,How many of you would switch to PC if you could bring the controller with you?
"I complimented the amount of work put into it, just seems like an odd oversight.",0,space,"Well, that guy looks like a giant looming over that girl to my brain, so evidently you don't need 'em!"
"All of the Deadly P playthrough is great, but the final two or three episodes where shit just goes fucking bonkers is probably the best",0,TwoBestFriendsPlay,"What do you think is THE FUNNIEST Best Friends video? For me, it has to be the old Man vs Wild Machinima episode. That had me laughing the hardest, and the longest of any video I've ever seen. The way nature conspired against man was just perfect."
"I never understood why in America they couldn't just include the tax in the cost like they do in England, still paying the same tax just easier.",0,AdviceAnimals,"""How much is this?"" ""Dollar ninety-nine."" ""Okay."" ""Alrighty, your total comes to Two seventeen."" ""I thought you said it was a dollar ninety-nine..."""
You just said it was due to anxiety?,0,vandwellers,That's why I pushed it off. Need the van first
Edgy.,0,worldnews,You can't seriously expect someone who was pro-brexit to know how gravity works...
Still not a bigger waste of copper than pennies,0,DesignPorn,My girlfriend couldn't find a stapler she liked for her shop so had a vintage one copper plated.
I'll try to tone it down a bit,0,fivenightsatfreddys,"After last time, I'm scared."
"If everyone decides to vote for someone ""with no chance of winning,"" guess what happens.",0,technology,"Ok, both candidates that have any chance of winning are incompetent"
Shot location?,0,Seattle,From last night's sunset
Top 5 destinations for NBA expansion?,0,nba,"Hey it's Bill Simmons - it's Saturday AM and I'm bored, let's talk hoops, it's a pseudo-AMA!!!!"
Apparently another little known side effect of roids: being completely delusional.,0,NYYankees,Alex Rodriguez wants to be a 'role model?' Excuse me while I go vomit.
Good luck on Price :),0,baseball,"If the option is vested, he'll become the first $200MM pitcher in baseball history. The extension is for 5-years on top of the 2 years he's already under contract. Congrats to Tigers fans!"
Usually between 400-2000mg a day.,0,AskReddit,How much do you consume?
"exactly, the more people you add, the more variables for the machine to process and work with",0,battlefield3,"more people, more bullets, more stuff to blow up. it also is hard to make something so big look good too. that was part of Frostbite's draw was the ability to make everything look real and pretty. I played MAG on the PS3, up to 256 players. it was nuts, but looked like launch PS2 graphics and the sound wasn't good either"
He looks like a crack addict lesbian,0,movies,Jared Leto Is Nearly Unrecognizable With Green Hair and No Eyebrows
Holy fucking neckbeard bro.,0,tifu,"Wow, such a baby that he has to have his girlfriend barter him with sexual favors to take his own goddamn medicine that he needs. This guy sounds embarrassing. What a bitch boy. Ya see, this type of shit never would have happened back in the old days when men were raised to be the man of the house. Well folks, this is where we're at. An entire generation of weak men who need their women to help them swallow some medicine. What a time to be alive."
"If I lost my eye, I'd never laugh again.",0,IAmA,"While it's terrible that you've lost an eye, I can't help asking if your sense of humor went with it too?"
well all of those 4 are on ELC's so theyll be up in 3 years min,0,hockey,"2 years at a reasonable salary. Would have been nice to lock him up a little longer, but it mitigates the risk and means he'll be up for a new contract when Provorov, Morin, Sanheim and Ghost Bear are (hopefully) all up."
Somehow I have you at +9 on RES... Keep up the good work.,0,baseball,I was thinking more along the lines of the stadium getting swallowed by a sinkhole.
u dum den,0,Jokes,I thought that the joke was that he was able to get a job after going to college for a second there.
This is a leg day I never skip.,0,swoleacceptance,Tis best to have a partner when working out the third leg.
"I do same thing, reddit app has a bar at the bottom that you swipe up to see comments",0,nexus4,Out of curiosity how do you manage to accidentally launch it? I think I may have accidentally launched it like once since ive had the phone.
"I'm 99% certain that it required 20 GB when they wrote up the requirements, aka when the game popped up in early access, and that they just haven't updated them accordingly.",0,killingfloor,Why misleading requirements? The game says 20 GB is all you need. The game is around 30 GB big at the moment and around 10-20% content is missing.
"It is, Arms 3 is the most impacted...",0,Windows10,As long as it's not impacting performance I wouldn't worry too much about it.
wow for the first time since i cant remember,0,berkeley,Cal Football ranked #22 in the country! Go Bears!
Fucking lol'd hard.,0,enoughsandersspam,"Poll worker: Do you want an ""I voted"" sticker? Berner: AM I BEING DETAINED?"
I wish I had the money it looks like it fixes alot of the problems I had with Majoras Mask,0,CFBOffTopic,"Majora's Mask New 3DS back in stock tomorrow. (Or today, depending on when you see this) If any of you guys are nerds/interested in getting this and missed out the first time, Gamestop will have these back in stock tomorrow. Most stores are only getting four, so if you want one, call ahead and see if any stores close to you received any."
Post more pictures and let us enjoy moer of you ;D,0,PetiteGoneWild,House to mysel....what should I do? ;)
