text,label,subreddit,parent_comment
I would consider this fake news mods,0,nba,Per Source: Bucks front runners to sign Durant
"My god, those gelatinous pixels are missed",0,gaming,What the fuck is that video quality? Like 4p?
This forum serves a specific purpose.,0,gonewild,"Why is this needed? What great crime has been committed against you when you fap to a picture of an internet model while thinking it's a girl on reddit? If people sniff out a faker and post it, more power to them, but there's no reason for the real posters to use sign."
"It's SFW, don't worry",0,fivenightsatfreddys,I probably shouldn't watch it....
Good: * Write well * Educated * Not a tool Bad: * 25 and in undergrad until 2018,0,OkCupid,What are your 3 good traits and the one that makes people close the tab in disgust?
"Get a phone that supports band 12 (there are a few cheapish ones out there, the Nexus 5X has it and is on sale right now), get a T-Mobile sim and setup the $30 prepaid account for 5GB data.",0,tmobile,"Noticed the new 700 reaches me finally with fair 4G connectivity, but how can I test it? First post, SUPER NEW to reddit! In semi-rural Georgia, noticed the new 700 reaches me finally with fair 4G connectivity, but how can I test it? (on Verizon iPhone 6+)"
"I will travel, across the web Blogging far and wide",0,TumblrInAction,"To outshine is my real test, to clobber them with my cause"
I wish more states had Castle doctrine.,0,politics,They shouldn't have tried to rob him. They got what they had coming.
Ricotta cheese has good macros.,0,hockey,It's the keto diet. I wanted something that was high in protein since I'm going to start lifting again so I opted for that. If there's alternatives to avocado I'm all ears.
"thats evil, to ban the worse one.",0,yugioh,Just A - Assault Core. No need to ban dragon buster if they can't summon it.
"Nah, mod glitch.",0,civ,Huh. I'd assume the proximity to the ocean allowed that to happen.
I want to believe.,0,AskReddit,"They actually took the dog? It seems like it'd just be a ""your word against his"" situation."
"Corduroy, bitches",0,AdviceAnimals,Leather here. Let's get this party started.
"Well since the hand was obviously aware of the hesitation maybe it could sort of sense the reason why being unwillingness to kill someone/mercy rather than ""I have orders not to kill this person"" .... does that help your understandably troubled mind?",0,harrypotter,I still to this day have trouble with Peter's death. His hand strangled him for not killing Harry right? Even though Voldemort had explicit orders to his entire organization that Potter was his kill.
"Op's post of next month: Randy loved my gift and took it the wrong way, Sister and Husband are furious",0,relationships,hmm that's a good idea! thanks!
Same here although she has a bit of a reason to be jealous.,0,StardewValley,My wife Emily is only mad when i gift her sistr Haley xD
One of my cats loves getting his belly rubbed for some reason,0,AskReddit,"If someone touches your stomach for too long, you're allowed to kill them."
Thanks,0,gundeals,See comment below.
Love it &lt;3,0,GoneWildPlus,"85% sweetheart, 15% slut"
Because they knew he was pointing the gun at people in the park... And that people felt threatened by Him which is why they called 9-1-1,0,news,"Here's what's interesting. The video shows that Tamir didn't even have the gun out when he was shot. So, if anything, he has his hands in/around his pockets/waistband when the cops come. He may have just been lifting his shirt to show the police where the gun was. Ohio is an open carry state; anyone with a licensed weapon can carry it around. I assume the police know this. So why is this kid automatically shot, when he technically has the right to be carrying a weapon?"
"This right here, destroy the Democrats and let the Republicans splinter into Libertarian/Religious/Nationalist parties afterwards if we need more than one party.",0,Conservative,Democrats don't appear to want it...they are lawless and must be destroyed politically and left to wander amongst the garbage and trash.
I think you just made that up.,0,IdiotsFightingThings,"I may be wrong, but I believe an impact from inside would create a lot of tension in the structure of the glass, which ""pulls"" tiny cracks/defects apart. An impact from the outside creates more compression which ""pushes"" them together. Of course, there'll always be a limit to what it can take from the outside too, but that limit should be a little higher than the inside limit."
You can't give yourself strep again if you are already immune to it.,0,trees,"Marijuana and Strep Throat So I've had strep the past few days and I'm also a chronic marijuana smoker. I did some research and found that smoking doesn't adversely effect your body or the medicine because it's antibiotics and stuff. So if you have strep and you're thinking about smoking here's a few things to think about: -If you're still contagious don't smoke with others out of courtesy -clean your pieces in between seshes so you don't give yourself strep again -smoke indica because it will help you sleep with the fever and chills. Love the whole community, happy toking."
70 shipped,0,supremeclothing,"How much, I have been looking for navy"
Considering how the UK has treated young people in recent years I wouldn't say they owe it anything.,0,unitedkingdom,"So you don't think you owe anything for the education you received before your degree, to the NHS for bringing you safely into this world, for the myriad of services keeping your country a tollerable and civilised place to grow up in? Well don't let the door hit you on the way out."
"I know, I know.",0,TumblrInAction,Oh for fuck's sake
"Good luck, you're gonna need it.",0,Bitcoin,"Nobody is bragging, i'm just stating that people don't know what they are doing on their PCs and then cry like babies when they lose their coins. There is nothing wrong with Windows(except it has a couple of backdoors) but I believe NSA has more important things to develop than reading what a guy on reddit is doing."
"Plot twist: Seconds after this photo was taken, little Joey Snot here was killed when a nearby oxygen tank exploded because he does not follow other people's rules, man.",0,trashy,"""This is a smoke free hospital"""
"The incentive that the agents have in honoring cypher's agreement, even though cypher would have no way of knowing whether it had been honored or not is twofold: one, as a PR exercise for the benefit of future potential turncoats; second, it doesn't cost them anything... All in all, he still ends up with the best deal (until the other fuckers mess it all up that is...)",0,comics,"Because they believe in the value of having a real, authentic experience with real, authentic people (in a dystopian sci-fi future). The problem I have with Cypher is that he demands all these awesome things but insists on not remembering *any* of it. Clearly, the Agents have no reason to honor that agreement and might wipe his memory, then make him live a miserable life. It's not like he threatened (or could threaten) the Agents with some information that might be released if he's not objectively happy and self-satisfied all the same. That being said, his bargain with the Agents of the Matrix is very relevant to this hypothetical machine. If he's got an awesome life, but he remembers the past and knows the truth, the possibility for knowledge and regret seep in. How could he ever enjoy his gains when they can be granted or taken away on a whim? Perhaps he knows that the knowledge of his betrayal will make him unhappy or that his knowledge of the ""truth"" will prevent him from forming any meaningful relationships; he'd be alone, unhappy, and surrounded by empty, vapid people. With this happiness machine, you're aware that your happiness is delusional and inauthentic. Perhaps you wouldn't care at first, but eventually hints real life will remind you that you're stupidly happy for no good reason. This will gradually diminish the effect until they're utterly dissatisfying. They're now only a reminder of how alone and miserable you actually are, despite how you outwardly feel. No one else can share in your delusions and you recognize them as being insubstantial. Putting someone else in the machine, someone who isn't aware of the machine's effect, is also going to make you unhappy because no matter how hard you try, you wouldn't be able to break their false sense of happiness. They believe they are having a convincing, authentic experience, so they experience true joy. They'd do anything to rationalize their experience and discredit your claims to the contrary. Even if you could break their delusion, you'd only gain the small, temporary satisfaction of knowing that they have been made unhappy for the rest of their life."
"Lol, it's pretty great.",0,fivenightsatfreddys,Just tried that. You win the comments.
I ain't never seen no queen in 'er damned undies,0,lebowski,"The Big Lebowski had a ""Production Goddess""."
It's the lack of foreshortening I think.,0,Rivenmains,"The lowered arm looks a bit weird, but that might just be the shading messing with me. Nice drawing op."
Aww... thanks!,0,tf2,No.
Isn't the name of the person in charge of an administration suppose to come first?,0,politics,"Bush, Cheney created the Iraq mess; why not make them try to fix it?"
"We have a bunch of people who scream ""Keep the government out of our lives"" until someone wants to have a gay marriage, abortion, drink on sunday, or smoke some weed.",0,AskReddit,"I moved from London to a rural area in a Southern state. I absolutely love America but the impact of religion on the place is really hard to get used to. It's a minor quibble but I accidentally moved to what you all call a ""dry town"" which, to me, doesn't smell like freedom."
"I've actually accumulated several 10s and 17s over the time I've had these cars, haha.",0,BMWE36,"""Where'd the 10mm go"" - story of my life..."
aight reminding you,0,fireemblem,That sort of looks like my lucina shirt Someone remind me to link a picture when I get hone
He shall be.......,0,news,"He shall be A1A5KA, and he shall be a good man."
"Same thing happened to me with a Jigglypuff, FeelsBadMan",0,pokemongo,....and I have officially lost motivation to keep hunting.
lol security apps like that end up doing more harm than good.,0,galaxynote4,"I just figured out the problem, an app called applock had locked my settings by default."
I think they want to encourage immigration according to some of their policy plans.,0,unitedkingdom,Who said they would let you? Presumably Scotland will have border controls.
I thought red was the feminist hair colour?,0,KotakuInAction,Someone was being clever with the Wiki entry for blue hair.....
"He's definitely excited, that's something I like",0,hockey,am I the only one hear who thought that was a great call??
"You're missing the part where gun stores must have $1,000,000 insurance in the event of ""damage to property and for injury to or death of any person as a result of the theft, sale, lease or transfer or offering for sale, lease or transfer of a firearm or ammunition"".",0,Firearms,So no more kitchen counter FFLs; must have a business address That business needs cameras and an insurance policy Did I miss anything?
This is attempting to slay the trolls.,0,CivilizatonExperiment,Don't feed the trolls.
Kevin Smith,0,Marvel,Great writing. Who's the writer here?
RTR,0,aww,My 70lb baby girl didn't quite survive our Freedom Hike today :/ Teamwork.
Telepathy,0,AskReddit,You have to select one of the senses to get rid of. Which one do you choose?
Where does she think spooky dinosaur skeletons come from ?.....Toys R Us.,0,AskReddit,Yeah I could have said stuff to 10 years ago me but I'm pretty sure he wouldn't believe someone could change that much. (went from saying her family was religious but she wasnt to listening to christian rock 24/7 and telling me basically i was going to hell for believing in dinosaurs... sigh)
I guess he said his mom sews all of his clothes for him.,0,pics,A bit big for Verne. It would be like a dress on him.
Mavs pick LMA,0,nba,What would happen if DeAndre Jordan and LaMarcus Aldridge both agreed to sign with the Mavericks at the exact same time?
That's why I buy monster cable.,0,technology,"Yeah, basically HDMI is only good for short runs. Even SDI needs to be reclocked every few hundred feet. But HDMI you're lucky to go half that."
Tagged as ~~Cobra~~ Corporate Commander Shill.,0,pcmasterrace,Of giving game reviews out of his ass. He would not know a great game if it boned him from behind. He should lose some weight and shave his face.
I just don't want to be judged by someone hearing a one sided conversation.,0,DoesAnybodyElse,DAE not like talking on the phone in front of other people.
Mustard tiger!,0,todayilearned,Mustard is life
Or skip that and get a gun permit.,0,AntiPOZi,This is why it is important to lift weights and or have some self defense capability. Nigs gonna nig
"I usually try to arrange it so I'm not the only woman, and I also told my SO about it and he tries to make sure I get a chance to talk.",0,AskWomen,i've gotten that sometimes too how do you deal with that frustration that makes you almost not even want to hang out anymore
DONACDUM,0,GrandTheftAutoV,When it's Payday I make sure I don't act dumb
fuck,0,pics,Knockturn alley = nocturnally
He had too many job interviews to go back,0,todayilearned,"When an Irish brown bear goes white, it never goes back."
"When they go low, we go lower.",0,politics,"So, the right lowered the bar and now the left can get as low as it wants ?"
the Galacticos used to win matches like that,0,MLS,Our team is currently going the Hoffenheim route of hoping to win matches 4-3.
That's very open minded of you.,0,hockey,"I just really can't do anything but hate Lucic, he constantly just looks like he's trying to hurt people."
Seriously who would be able to multimod and do so without being sure if it's good,0,pathofexile,Shitpost; you know its GG.
went and found the song immediately,0,videos,College in 6 seconds
God I hate facebook regardless.,0,australia,Mum applauded for Facebook post against 'slut-shaming' school talk in wake of porn ring scandal
U havin a giggle?,0,Unexpected,U WOT M8
We might as well jump ship to a Mantle's Approach-class ship at this point :D,0,korrasami,Oh my god! This ship will never die! All this proposal stuff is breathing new life into this sub!
How many more to go?,0,conspiracy,Swedish men burned 9 refugee centers to the ground.
We've played Arteta with Flamini on occasions....,0,Gunners,To all those people saying we are going to play him together with Coquelin that not likely to happen unless as late sub. Only time wenger would play a defensive lineup is if all our attacking options are injured or limited. The whole point of buying el nenny is to replace arteta and partner ramsey in the middle and allow the team to all out attack without losing control of match. Ramsey wouldn't be out of position if we keep the ball better farther up the field. Ramsey/wilshere/ox/walcott do get preferential treatment anyways because they are the British core. So unless their form drops off a cliff they will be getting starts.
"No, I'll admit I can't understand misogyny, just like I can't understand racism or any other form of hateful bigotry.",0,atheism,"Well with that logic is there any scientific reason to keep a severely handicapped person in higher regard than a living, breathing, adult human being? A huge amount of laws aren't based around a scientific reason, but a moral one, and I'm sure you would support plenty of them. The whole argument revolves around ones definition of when life begins. Some believe it begins at conception, others at the first recognizable heart beat, others at birth. You are just actively ignoring the other side of the argument. And a disclaimer, I'm not on the pro-life side, but at least I understand it. Can you say the same thing?"
"Just a reminder this is an easy way to get +2,000 karma.",0,politics,Just a reminder: It has been 1165 days since Sean Hannity offered to be waterboarded for charity.
AAAAAAAAAAAAAAAAND they are as expensive as the game itself.,0,totalwar,Anyone else noticed the Games Workshop link now has 9 figures which are called Total War Miniatures?
"Nice surprise, I imagine.. :)",0,SubredditDrama,I backed the Undertale Kickstarter way back in 2013. Had completely forgotten about the game until it was released in 2015. No regrets.
Where?,0,Android,Went into my VZW corp store. The district manager was there. I asked about the device. He stated it is still a lock for tomorrow and that they would be changing the floor plan later tonight to bring the Nexus on the floor. He also showed me his business Nexus.. that is where I blacked out and started drooling...
"I know, I was just trying to be funny -_-",0,Guildwars2,He meant specializations
"I'M NOT ENTIRELY SURE EXACTLY WHAT MARY HAS TO DO WITH IT, BUT SHE ASKED THAT ONE GUY TO STOP CALLING HER SISTER FAT, SO SHE PROBABLY HAD SOMETHING TO DO ALL THIS, ALSO",0,ShitRedditSays,FUCK PARTIES AND ALSO I WILL MAKE CONSTANT UGLY RACIST AND SEXIST COMMENTS ABOUT BOB
What's tap to pay?,0,apple,"Apply pay just came out in Canada last month since our banks were dragging their feet to hold up their own INTERAC system. That said, tap to pay is much more prevalent in Canada compared to the US."
Fuck Steve.,0,AskReddit,Lol
***COUGH***,0,gamegrumps,Jon and Arin have at least 3 pet Geese; anyone who enters the Grump Room during a Game Grumps sessions joins the gaggle (confirmed by Jon at Magfest). Jon is also always sick.
"The sound would be hilarious, though.",0,Showerthoughts,"The upper ass crack would catch on the metal causing it to be pulled upwards. This would cause the epidermis to undergo tensile strain, possibly causing fatigue failure and epidermal ripping, slicing open the soft interface between the upper and lower cheek."
Well that sucks.,0,wiiu,"No, just certain songs. However, the main battle theme, as well as the main city theme, are two of them."
3 majors in next 24 months gets him up there with Spieth and Rory.,0,golf,I was more or less talking world rankings. I know as far as the best overall talks go he has a ways to go.
"Shit, I thought you meant brought back as in revived and got so excited.",0,AdviceAnimals,Was recently brought back to netflix US!
Crown Point is not far and it's a great town (if you're white... I'm not),0,AskReddit,"I wondered if I'd see this city on here. Honestly there's no NEED to stop there, there are plenty of other areas surrounding that are just fine (if not really nice). That being said, not everyone who visits Gary dies. Indiana University Northwest is there, and apparently there is a fabeled ""nice part"" of Gary too."
I'm pretty sure every photo of kids their age turns out similar...,0,TheSquadOnPoint,The thug life starts early
Umaga and John Cena,0,SquaredCircle,What are some examples of two completely different wrestlers having a surprising amount of chemistry together? I'd say recently Kevin Owens and John Cena is a perfect example of that. Another good example would be Triple H and Mankind
You da real MVP,0,xposed,"You stole my karma! (I kid, thanks for posting.)"
Booty had me like,0,Frozen,My new personal favorite screencap of Elsa
[*being nervous intensifies*],0,AskReddit,"If your life had subtitles, what would they say during times of no dialogue?"
"I'll see if I can dig up the manual I found online again, I don't remember it having anything about oiling... but I was also very frustrated and it was very late haha.",0,sewhelp,"Have you got instructions? You could probably Google them if not. If you still can't find any call up your country's singer hotline and they should be able to help out with the oiling and problem in general. They are usually very good, well, the UK one is anyway"
yeah right,0,worldnews,Seahorse seahell
thats enough internet for today...,0,AskReddit,Fap to anime bdsm porn and try to cum on their faces.
pretty frickin cool!,0,swtor,PvP Leaderboards
Pinkies in Doom 64 are terrifying.,0,Doom,DOOM monsters comparison
Very cute.,0,amiugly,Am I ugly/ can I improve? Do I cut it?
Ps We've been close friends before starting to date if that makes a difference.,0,sex,"Gf says she feels like a toothbrush? I've been saying this girl for about two weeks and things have been going great, but last night I made a move to finger her and she gave really positive feedback so I kept going and she said she ready enjoyed it and it was fine and all that jazz. But today she says that she kinda feels like a toothbrush and I have no idea how to respond to that. Did I do something wrong? My gf has had commitment problems in the past and maybe it's just some of that coming back? What do I do?"
I heard you don't care about black people.,0,RoastMe,Roast this man
Flavortown needs to be a restaurant in Disney Springs.,0,WaltDisneyWorld,The recession really hit Flavortown hard.
Team 1114 - I wasn't actually on the build side rather the 3d animation portion of the competition.,0,Drifting,"Team 1706 represent. We went from rookies with a thousand bucks after buying the kit, to yearly region terror in my 4 years and I hear the team hasn't missed a finals since I left. It taught me to weld, solder, and engineer in a way nothing else did. It's the shit!"
"Got the Vikings D, Zach Miller, Dwayne Washington and Kenneth Dixon",0,fantasyfootball,Week 4 Waivers - Who Did You Get? Another week that I was paralyzed in fear about using my #1 waiver. Worried I should have picked up Pryor. Who did you get?
I can resist almost anything except warm Monkey Bread and a stick of butter.,0,Breadit,First time Monkey Bread.
A love seat or sofa: The fact that I don't have one gives you a hint as to just how lonely I am.,0,AskReddit,"If your partner was described as a household item, what would they be?"
"Amateur, i have 3 sisters and 5 brothers and have been alone for as long as i can remember",0,2meirl4meirl,Bitch please I'm already on it and I have a sister.
"wsj == Fox Same owner, same agenda, just as trustworthy",0,Economics,Good Jobs News: More People Are Quitting
I see they still can't figure out to cover Olsen.,0,Seahawks,"Game Thread: Seattle Seahawks at Carolina Panthers Game time! Please read below! And as with last round, a reminder that we're clamping down harder on rules leading into, during, and after the game. We will also be locking down the subreddit to submissions at some point in the game. That will be lifted at some point after the game depending wholly on the results. Please don't harass the opposing team's sub or fans. If we catch people blatantly disrespecting other subreddits, consequences will also play out in here. But most importantly of all... #Go Hawks!"
Was he wearing a black turtleneck?,0,worldnews,Buckingham Palace arrest: Man detained in grounds after scaling perimeter wall
Olibur should be honored,0,arrow,"I hope he's Felicity's boyfriend and he bangs her, IN FRONT OF OLIBUR."
Half-life 3,0,AskReddit,What video game was the biggest disappointment?
"If someone who you really don't like asks you to do them a favor, you will like them more after doing that favor.",0,AskReddit,"What sounds extremely wrong, but is actually correct?"
Looks like Fellaini moves out the way?,0,soccer,Westwood's goal to make it 1-0 for Villa
These guys are one of my biggest musical influences.,0,Deathcore,Let's go back to 2006.
Fake or gay.,0,gifs,Finish the fight. With your chair.
It's likely you're just paying less attention to your studies.,0,AskHSteacher,"What's wrong with me I've recently been hanging out with a chinease boy for the last few months. I currently attend high school and we have majority of our classes together, I've recently noticed that in subjects I normally excel at. I was wondering if this sudden decrease in grades and my sudden 'autism episodes' were a result of my chinease friend."
"Nope, just snakes and sparklers.",0,funny,No Mohawk? No Ace Ventura? No Jheri curls? No Alfalfa?
"But it IS a bug, Riot just let it be as a feature.",0,Rivenmains,"Holy fk that malph said ""animation canceling"" is a bug. Oh my god my my eyes hurt"
Is it really a question?,0,AskReddit,Hugh Hefner ?
Oh well then congrats and call her up if you don't hear from her here!,0,houston,Well I did get her number...I thought maybe she'd chuckle this way :)
now I have 2 reasons to own a bus...,0,VictoriaBC,"If someone owned a bus they could totally charge bus fair and do a cupple routes, they'd make some good cash I would think."
WTB Grey GR1 21L - Thanks!,0,Goruck,"Weekly WTB/ISO thread - July 4, 2016"
I like when a cops asks for id when it has nothing to do with the matter at hand and they're only hoping for warrents.,0,Bad_Cop_No_Donut,I like when people ask the cops for 3 forms of id. It lets me know that they're idiots.
"I doubt you added the ""considering you didn't text me for five hours"" bit, though.",0,creepyPMs,Oh god I feel like I've said this stuff before...not because I'm jealous or crazy but because I'm trying to playfully ask about the other person's love life to see if I am free to pursue.
"You cannot ""feed"" in csgo",0,WritingPrompts,Could be CSGO from the marketplace.
If this doesn't scream 'mental illness' then I don't know what does.,0,cringe,Guy goes ballistic at guitar store
This is Garbage.,0,Music,Garbage - I Think I'm Paranoid
I have a steel wedding band... It seconds as a bottle opener...,0,funny,"To some a party trick, to me a daily part of life."
"7 dead and 500 injured, for now.",0,worldnews,"I am having a difficult time comprehending the magnitude of the loss of life. I can't even think of another peacetime disaster of this proportion. The Halifax explosion killed close to 2000, this has to be much larger than that. I feel sick."
