text,label,subreddit,parent_comment
"As a hammer enthusiast I would have to disagree,",1,science,So lets ban hammers!
It okay cause Google is a private company and they can show bias in their search results.,1,politics,Trump left out of Google search for presidential candidates
You mean *causing* autism in folks?,1,politics,Vacinating folks
That should solve the problem,1,indianews,SC orders ban on sale of firecrackers in Delhi-NCR to curb rising air pollution
This must be the director's cut!,1,marvelstudios,CA:CW Epic runtime!
Alolan aerodactyl?,1,pokemon,Gen I Bonus Drawing #2
"Yeah, our goaltending is shit.",1,OttawaSenators,If only we could get our hands on a goalie like Lehner.
..but he's 30,1,minnesotavikings,Just ripped
"Oh thank God, an Internet petition.",1,conspiracy,Theres a few petitions aroundto get her to be charged
Getting tasered is actually the number one thing I would like to happen to me if I was in cardiac arrest.,1,AskReddit,"What the fuck??? I hope your supervisor chewed him out, that is really dangerous!"
"Hey man, M$ only scans manga they love!",1,manga,Soo guess mangastream picked this up now?
Pretty sure his comment was,1,AskReddit,Probably because they're ***rotting six feet under.***
"Because it's part of Herr Synder's evil secret plan to kill all the black adults in flint, give all the land to the rich white people, and sell the kids into slavery in Canada.",1,Michigan,How does this have anything to do with racism? Flint is a very poor city and is obviously poorly run. Plenty of people live there that aren't black. My mom for example. Maybe instead of pointing fingers people should try to clean that hell hole up so maybe one day there will be more business interested in coming there and helping the economy.
"Yeah, but they said they don't give a shit if ants are animals :(",1,roosterteeth,"Yeah. Wishing for someone to actually give a shit in this and not shoot the shit for this, so to speak."
"So they are only ""caught up"" if they act like you and agree with your views and opinions about the world?...yeah they definitely need to work on being more tolerant like you.",1,OldSchoolCool,"Too many rednecks flying the confederate flag still to let you guys jump on board the ""We're caught up"" train. =("
Yeah check helk and Garry's profile; if you look at their hours it's obvious they don't play,1,playrust,Do the devs play their own game?
"Oh I forgot, when I use peasant, I am super serious.",1,WTF,TIL there is such a thing a bicycle elitists. As well as the fact my dad was wrong. There is something more pointless than underwater basket weaving in college.
"great post, i've not seen this a hundred times since forever ago",1,funny,How CSI works
Because they're entitled to it...because...well...just because!,1,politics,"Not their greed, YOUR greed. Why do you people feel entitled to stuff that isn't yours?"
But they're not C9 tho,1,leagueoflegends,Still near the same amount of viewers
Burning team captain,1,tf2,What hat do you wear most of the time?
"So this only works if they're married, then?",1,todayilearned,TIL: Women who perform oral sex on their husbands decrease the chances of some complications during pregnancy. The incidence of such complications decreases further if she swallows.
These police need military weapons to combat those non compliant veterans in nursing homes.,1,Bad_Cop_No_Donut,"Suburban Chicago police shot a 95-year-old WWII veteran to death with bean bag rounds at short range because he refused to go to the hospital, his stepdaughter claims in court"
This man is a MONSTER!,1,HillaryForPrison,The Blowback Begins: Marine Demands Same Treatment As Hillary
"No, 100% of redditors here are challenger/bronze 5 KR.",1,leagueoflegends,O I forgot I couldn't make an actual post without forgetting that half of reddit is silver/bronze elo
D1 is low diamond,1,leagueoflegends,Can you link a frontpage post that's been in low diamond? Most of the EU/NA Players on the Riot Accounts are against D1/Masters...
but...but he killed meruem,1,HunterXHunter,"Such a good guy saving lives, like when he viciously attacked Leorio with a friggin ax.."
I heard gum can help remove peanut butter,1,Parenting,My 1.5 year old son got peanut butter in his hair. I heard an effective way to remove it is in the microwave. How long do I leave him in for?
Because that will totally happen.,1,newzealand,I live in dread of the day our minimum-wage laws get gutted to the point where hospitality workers are forced to rely on tips to live.
"What do you mean, I thought interupting people and making them hate whatever cause you represent was the best way to make a difference.",1,cringe,its pretty cringe because no one in the restaurant gives a fuck about them and they think that this is how they will make a difference
Lose our two biggest liabilities duh.,1,nba,What does Houston get?
4s lipo box or go home.,1,electronic_cigarette,"Almost every day, I prefer the vape a mech gives At least until I find someone to build me a lipo pwm (or modderbox start taking orders again)"
"Haha, oh yeah, she's so ""progressive.""",1,SandersForPresident,"I was, until he lost the primary. I'm proudly supporting Hillary to see a continuance of progressive policies."
"Because MaryJane looking accurate to the comic is hands down, more important than anything going on in the world.",1,movies,I'm with you. Not sure why you're getting downvotes. Likely man-children who can't let go of minute details from the source materials and allow for change.
"no, dumbass, having money and spending it should be illegal",1,pics,"Why? I make a lot of money, so I can easily afford it. I am going to wear it every minute of the rest of my life (I literally never take it off). Platinum looks nice and is very durable. Seems like a reasonable decision to me."
"Yes, since better jobs are a dime a dozen and dental care is standard with health insurance in the United States",1,AskReddit,"Get a better job, or get a job with dental care????"
Eyy movies from hollywood is a good source for USSR warfare in WW2,1,CompanyOfHeroes,Well Russia got understandably pissed for the campaign portraying them in such a bad light. I don't believe for a minute Relic did so much historical research for their 'authentic' campaign.
"Naah, demons need at least 10GB to operate so all your drives are safe.",1,pcmasterrace,"Help, is my Steam drive possessed now?"
***THATS NOT YARNE YOU FUCKING SHITBIRD***,1,fireemblem,"There, I made the stupid unfunny joke so no one else has to."
But what if they're starving for a nice tight white Norwegian arse?,1,KotakuInAction,Want to know how much it matters what had happened in his past? 0%. There's no fucking excuse for rape. There are some crimes where I could be sympathetic towards the criminal such as stealing when you're starving or getting arrested for smoking weed but rape isn't one of those.
oh yeah thats exactly what I mean!,1,Christianity,"Ah yes, reap the benefits of society but then discard it as evil and wrong when it suits you. Got it."
Hide yo wife hide yo kids...,1,AskLEO,Is that something you come across pretty often? Cops in uniform just rapin women everywhere
"But, but, he's the English player...gotta shit on the English player...must be their fault",1,soccer,"3 mistakes by City on that goal, although I'd say Hart's was the least egregious."
Probably all those NAMBLA donations.,1,CringeAnarchy,I vote for my POTUS based on what house they would be in from a fictional British book series
"You know how Rogan always says in his podcast that guys who are very vocal against gay marriage are almost always gay themselves, it all makes sense now.",1,MMA,touch the legend)
Taking as many of you with me as possible,1,AskReddit,What is your preferred way of dying?
There should be a tl;dr somewhere in the document for them to read.,1,technology,"I'd say we should limit the language used in the bills and push for clearer wording. The fact that some bills can be so long is absurd, there would be no feasible way to do anything in a timely fashion if everyone is constantly reading lengthy bullshit."
I am so sorry....,1,trees,Chin up bro. I drive a PT Cruiser.
You know exactly what it is you cis white scum!,1,CringeAnarchy,What the hell is a cissy?
He can learn English.,1,gadgets,Oh no! English isn't his first language! Don't let him do anything!
"Can you run ad-block on an iPad, or iPhone?",1,TumblrInAction,I'm surprised that none of the posts about the Scream ad mention the existence of AdBlock... I guess living in fear in more fun than taking action.
At least the people shaming them are just their buddies and not the mainstream media.,1,todayilearned,"And when they do decide to report it, they're shamed and made fun of ""Come on, bro, sex is sex! All men want sex all the time!"" The real fucked up part is there are actually people out there who think men can't be raped. (I'm looking at you, tumblrinas)"
Opsec!,1,evedreddit,"Recently accepted into Dreddit, decided to check out the wiki and found this. I'm glad you guys find ways around the problem of having too much ISK. Eschatos' ""What is this I don't even"" Mining Kronos High 4x Mining Laser II 2x Small Tractor Beam I 1x Salvager I Mid 1x 100MN Afterburner II 1x Warp Scrambler II 2x Cap Recharger II Low 2x Energized Advanced Nano Membrane II 3x Mining Laser Upgrade II 1x Damage Control I 1x Large Armor Repairer II Drones 5x Mining Drone II You can mine while looking like a total douche. AWESOME."
Vagabond is a good ship,1,Eve,"Share your favorite lie about EVE game play which everyone believes Take a moment to share a fact about EVE game play that *everyone* knows is true... which nevertheless is definitely *not* true. In other words, share a sentence about EVE which is a lie that most EVE players believe is true. My current three favorites: 1. Drones don't decloak you. 2. Incursions are risk-free. 3. Everyone passive align."
Yeah cos most people that just got un-banned are gonna risk a bigger one for 5 minutes of messing with you.,1,GrandTheftAutoV_PC,Ah.. yeah. So that's why you encounter a cheater in almost every session again. The past two weeks were so enjoyable... :-/
"Yep, those estate taxes sure worked out well in that respect.",1,politics,"so? it's not income tax, it's estate tax. income tax exists to pay for ongoing operations, estate tax exists to keep wealth from concentrating into the hands of a few wealthy families who become a de facto oligarchy."
Turns out James is the *real* racist!,1,TheCreatures,I like how James jumped to Matt's ability to jump it being a race thing and not the fact that he's obviously an athlete.
But the rectangle is actually a C so it's clever,1,nba,"""What logo can we give to the most exciting, fun, energetic team in the NBA?"" ""I know! Let's put an LA inside a fucking rectangle!"" There's ""minimalism"", and then there's just boring."
HOW DARE YOU have any freedom at all?,1,Conservative,The joy of Liberals
"It's like Jesus said: ""And thus he spoke unto them: Mind not what follows from your deed or words, for the Lord Himself will right all that is wrong.""",1,politics,"On my facebook today I saw someone say that we don't have to worry about climate change because God is all powerful and won't let that happen. I'm not sure I understand this idea. If you don't eat, jump off a building, or drive off a cliff god won't help. Why do people think he'll help with Trump or the environment? I truly believe we will be our own demise. A failed species."
"the only race that isn't PoC is those whiteys, of course they never have been sold into slavery",1,TumblrInAction,Also ignore slavery of any other race or nation. Only PoC suffering is worth talking about!
Good one,1,worldnews,So chickenshit?
"I'm passionate about my tabs, the abuse against needs to stop.",1,pcmasterrace,Little late to this thread you think? lol
"Patriots can only be American, duh!",1,worldnews,Expat from what country if you don't mind me asking?
"Woah woah woah, a marine being an asshole, that's totally unheard of isn't it?",1,trashy,Bachelorette star poops pants after drunk rant
"This is how Zombie Movies start out like, eep.",1,news,Unknown illness spreads from woman to deputies and hospital staff.
But it makes you cool and hip to say it.,1,hockey,Can we try to not use the r word?
As a Canadian I find your comment offensive.,1,food,As a Canadian I find our love of maple ridiculous.
Dammit now it's not only sips ruining everything but his fans,1,sips,You fuckers only went and infiltrated another front-page post
"Because Ein doesn't talk, and women are meant to be seen, not heard.",1,TumblrInAction,Ein is the best choice for obvious reasons.
"Republicans will love this new smaller, less invasive government.",1,nottheonion,NYC 9/11 memorial features TSA-style screening of all visitors
"Ehhh we all need a little iron, and if you can't handle lockjaw, then you don't deserve a badass lunchbox like that.",1,OldSchoolCool,not to mention I don't really want a rust sandwich or tetanus chips.
"Yes, as I recall Philadelphia is chock full of beautiful women.",1,WTF,"You, and everyone else who thinks ""rave girls"" are ugly, have obviously never been to a warehouse party in Philly. Models &amp; bottles, all night every night."
I hope he's okay from that terrible hit,1,hockey,"Yikes, Hank diving like he's wearing a different red white and blue jersey..."
I do [],1,mylittleandysonic1,Nobody digs my directionless rage anymore.
We need the mountains to keep the swedes on their side of the border,1,europe,"The terrain is somewhat divided between two sides on the peninsula. Norway got the mountainous west, making it hard for any forest to grow, and Sweden got the flat and forested east."
But was there intent?,1,HillaryForPrison,'Arrested NSA contractor security breach depth'
*RFK was leading at this point in 1968*,1,hillaryclinton,reddit will keep saying that it's not decided and that everything can happen
Diver.,1,hockey,Dubinsky vs. Crosby last night.
Because games with in-game voice comms are so less toxic and much more social.,1,leagueoflegends,I feel like if Riot implemented voice coms we really wouldn't need solo queue.
Fuck you bro consoles are so fucking cheep!,1,gaming,Wow that sounds like a hefty amount of work...and money lol
Why would Le'Veon be called Big Ben?,1,nfl,it's the bell
"Get out of here, you filthy Brit",1,AskReddit,"Sorry to butt in. I'm English, pro gun, guns are fucking fun. I make no bullshit excuse like home security, and all this constitutional rights stuff is a load of horse shit. People buy guns because they're good fun. And damn straight, as long as you're not a dick, why shouldn't you?"
Vince,1,SquaredCircle,No one walks better than Steve Austin
In Texas this is a legit question!,1,Austin,Wait... Tried to rape his sister and aunt or sister slash aunt?
"It's not rape, it's ""undocumented consent"" you racist!",1,Conservative,"Sweden: 40 sexual assaults at music festival, all by Muslim migrants"
I know every single thing we've seen so far looks good but something something EA,1,Gaming4Gamers,I'll just sit here waiting for someone to tell me why I shouldn't be so excited
"But it's not *explicit*, they didn't say it outright.",1,FanTheories,Yeah. It's quite literally the first thing you see on the show.
"Shit, when Eminem came out on James Franco's talk show, that destroyed everything I ever knew in life.",1,movies,"Still, Ricky Martin coming out shook me to my core."
"my dad is an electrician and when asked why he doesnt do it upside down he said ""fuck that, thats what circuit breakers are for"" I feel super safe with his work",1,todayilearned,"My friend is an electrician, and that's exactly why they're upside down. They do that at our school and work too"
by killing the nexus of course,1,leagueoflegends,How do you think they won those teamfights?
You must not be introverted then because introverted men clearly don't get laid,1,AskReddit,"Naw, I'm an incredibly introverted and have still gotten laid many times. It's not easy, but you just have to use the tools the have. Introverts tend to be really good in 1 on 1 situations with people they like/feel comfortable with, so make those kinds of situations happen. In a group, I'm inclined to stand awkwardly at a distance and not say anything, but I'm perfectly capable of carrying on a conversation about any number of things with just one other person. So, I don't do big group activities, but I do find reasons to talk 1 on 1 with girls that I like. The key is just to recognize what your shortcomings are and what strengths you have. You don't like small talk and beating around the bush? Directly ask a girl out on a date instead of some convoluted messaging about hanging out or whatever. Most girls prefer that from my experience because you've expressed your interest."
"Of course not, and of course I would be so relieved to know he isn't gay because being gay is somehow bad.",1,TrollXChromosomes,"Yes, at least you know that. If there's any one fact I need to know about my biological father, it's that he's not gay! *cough* I mean there isn't really much else to one's personality, is there?"
[yup],1,anime,Your lie in?
But she is a poor woman who was just defending her kids man,1,tifu,"Doesn't fucking matter, as soon as you ran she should have stopped, stabbing someone in the back is assault with a deadly weapon. On top of that she tasered you (presumably in the back) before stabbing you. I would call that attempted murder."
I didn't know Pinterest was a dating site.,1,creepyPMs,To clarify: I'm a Leasing Agent. I still don't know who this person is.
"Dude, hdtv lag.",1,funny,An I the only one that plays pc on a big screen with a Xbox one controller?
I forgot the,1,todayilearned,the answer is likely no one. Did Japan have any kind of social net in those days? what would his children's life be? That is something to consider.
damn that Logitech gear really must improve you,1,GlobalOffensive,Just another day in CSGO MM!
canada goose,1,Talonmains,"What kind of jacket does Renegade Talon wear? Im looking to get a jacket like Renegade Talons, anyone know what that kind of jacket is called?"
As expected...,1,EliteHudson,Well-written sir! I hope FDEV puts it up!
On the other hand she didn't even have the common courtesy to try and get Mexico to pay for it.,1,SandersForPresident,"To be fair, she just wants a smaller fence"
are they already out of jerseys to burn?,1,clevelandcavs,I think the fans would burn The Q down if that happened...
"Duh, it's because the cops are so much better than everyone else at using guns properly.",1,politics,It still amazes me how the narrative of blaming guns instead of holding the the murder responsible for his actions is first in the minds of the people who want the government to have the only guns.
More damage,1,leagueoflegends,... Wat
Elsie death loop confirmed,1,westworld,Something fishy about Elsie chocking
You know what he did...really at this point...what difference did it make.,1,The_Donald,Just a reminder that based Dr Shakil Afridi who helped the CIA find Bin Laden is still rotting away in a Pakistani prison while Hillary Clinton did nothing to free him.
"Great, the next terrorist plot will involve some dumbass walking across the US/Mexico border with a bomb up his butt.",1,OperationGrabAss,"An American student, who discovered he was included on the US no-fly list and was barred from a flight from Costa Rica, was reunited with family and friends after he flew to Mexico and then walked across the border"
"So, brothers in new york, have you instituted sharia law yet?",1,islam,Empire State Building in NYC lit up in green for Eid al-Fitr
Because eqaulity and tolerance!,1,worldnews,Or voting for them. Tell me again why we are supposed to want Hillary?
Pays for that little blue book of privilege...,1,dubai,"That's something I never understood. If I'm working and living abroad, I'm not using any facilities or services that my fellow taxpayers are contributing towards (Medicaid, public schools, city service, etc) so why should a tax be payed then?"
"When you have side mirrors, it is difficult to ride in the small gap between the buses or cars or in fact between two wheelers.",1,india,"Why are Vehicles without side mirrors, broken light indicators allowed to ply on the roads? Now a days it has become fashion to remove the side mirrors from the two wheelers. What the fuck? I mean, how are Vehicles without basic things such as side mirrors and broken indicators even allowed to ply? I am not saying by making mirrors compulsory people will use them.. but atleast make it compulsory so people might use it one day when it might save their life? I don't get it man.. fuck these idiots who have zero traffic sense. If you were a traffic police commissioner.. what rules would you impose to make lives better on the roads?"
pretty good... for a *female*...,1,climbing,Crazy move done at competition by a female (skip to 1:14)
"Yes, the outgroup is to be feared",1,politics,"Considering the right wing party will implement immigration policies that will probably save this holocaust victim from being another victim, her fears are completely misguided"
But this wouldn't have happened if more people had guns!,1,WTF,Cameraman Adam Ward and Reporter Alison Parker shot and killed on-air during live report at Bridgewater Plaza in Virginia.
1/3 of that 1.7m were robots.,1,The_Donald,"WOW! TRUMP Cleveland Rally Has 1.7 MILLION Views - Hillary Cleveland Rally has 3,825 Views"
So successful that it got cancelled TWICE!,1,television,Futurama wasn't and it was super successful.
It's because he's looking at the sealed portion of the book!,1,exmormon,Is that another depiction of the plates where it's impossible to turn the pages? I think so.
It's worked in the past!,1,worldnews,"Clearly they need better weapons and better training, maybe they won't turn on us (rest of the world) then."
"yeah, this looks totes legit",1,Fallout,Leaked Documents Reveal Fallout 4
Obviously we always fold a nut flush getting 4:1 when the board pairs,1,poker,I think it means the pot is equal to x and your stack is equal to x/2
I'm sorry to tell you... But you're the only one.,1,AskReddit,Nickelback
I guess this is Wizards' way of hinting towards the return of heroic,1,magicTCG,"""We're on a heroic mission!"" -Olivia Voldaren, who is certainly not on a heroic mission"
yes im so salty in only were ther for 2 fights followed up by a non-contested victory,1,Eve,Yeah the MBC are the salty ones
Well their logic is flawless.,1,rage,2k likes on fb....
That was a pretty good opinion piece...,1,Silverbugs,"Carlton Fisk is a stacker, and his house was just robbed for his silver, it is all they took."
Oh praise god!,1,gifs,How far we have come
Worlds stats has confirmed that.,1,leagueoflegends,League has died since s3.
666 Satan ai confirmed,1,RatchetAndClank,getting really sick of this shit
Street harassment!,1,pics,I just wanted to give him a compliment.
what do you mean they're all from na,1,leagueoflegends,Is CLG the most racially diverse team?
"Yeah after Anders Brevik, I am so sick of all white people.",1,worldnews,I don't mind Islam. Im really sick of terrorists though.
You listen to the radio!,1,AskReddit,Reddit: How do you find good music you've never heard before?
"""It could have been *worse...*",1,atheism,"""God"" did nothing of the sort. The country was not in any way spared; it languished under a horrific civil war for 4 years. But thank the merciful sky fairy that ""he"" finally got around to stopping it."
ITT: Proof that Microsoft's Marketing is doing a bang up job,1,gadgets,"HoloLens will run up to 5.5 hours on a single charge, Microsoft says"
lol How shocking!,1,nfl,Robert Mueller: 'We found no evidence that anyone at the NFL had or saw the in-elevator video before it was publicly shown.'
"Hardwork, ethics and integrity always pay off.",1,india,Professor Who Led Panel To Punish Rohith Vemula Takes Charge As Vice Chancellor
Biggest shock of the new year.,1,hiphopheads,Rap Wizard Chief Keef moves to a new home without telling probation officer; could land jail time
"Of course that's a saleen, says so right on the bumper!",1,Shitty_Car_Mods,"Looks like a saleen mustang.....saleen if you aren't aware, is a brand that sells souped up versions of cars...."
Genesis is skynet,1,pcmasterrace,NVIDIA Boosts IQ of Self-Driving Cars With World's First In-Car Artificial Intelligence Supercomputer
True.. there's no way SKT could have beat H2K,1,leagueoflegends,"Honestly, fans of those teams should probably want Samsung to win. It would mean those teams lost to the champions which looks better on them."
Yeah a rams defender falling into bens knee and burfict driving his knee into bens shoulder were his fault.,1,nfl,"Thank you. Look, he's still elite and all but it seemed like last year his bad decisions were too often. Including ones that led to him being injured. He gets all the credit but too many times it was the defense bailing us out with a timely turnover."
Check your pronouns!,1,Art,So he doesn't look weird wearing a bathing suit
Use an email address with the word dogecoin in it.,1,Bitcoin,"Wanted to post a simple ad in this FB group but it got deleted since my email had the word ""bitcoin"" in it. The admin found it offensive and said it was considered branding. (repost)"
BUT BATTERIES ARE SO HEAVY,1,teslamotors,"Elon on twitter: ""We *def* don't recommended this, but Model S floats well enough to turn it into a boat for short periods of time. Thrust via wheel rotation."""
It's a conspiracy by R* to make us buy Shark Cards I tell ya!,1,gtaonline,"Price of Redwood cigarettes Has anyone else noticed the price of cigarettes going up for the past few days? The original price was $6/pack, then yesterday it was $7, and now $8. What's going on?"
