text,label,subreddit,parent_comment
No worries there's Always Teambuilder,1,leagueoflegends,"I shouldn't feel like I have to get lucky to get my main role. My main(mid) to secondary(any other role) ratio honestly feels 50/50 or 40/60. I'm often partied with friends and on multiple occasions I end up getting their main role (when its my secondary). Maybe im just crazy and really unlucky, but honestly, salt. Any others feeling the same?"
Spoiler tag gosh!,1,gaming,"Actually she'll spy on you while you suffer through the temples offering no help along the way except some harp music. Then she'll get herself kidnapped, let you rescue her and her kingdom then she'll take back her musical instrument that you ""borrowed"" and send you back in time to live as a child after having been an adult for quite some time probably giving you severe mental stress. Oh and she fully expects you as a child to convince people that that Gandondorf guy is a bad person... AND she creates several different timelines dooming her people to pain and suffering and floods."
RF x Yeezi collab!,1,Sneakers,Just tweeted by Fieg. Possible release date for the RF x Puma collab?
My kid is going to grow up with dawkins quotes daily and I'll make them say their atheist chants every night.,1,TrueAtheism,"I understand what you're saying, but I think it's a false equivalence. I don't think avoiding mentioning religion is the same as training your child in one, and I don't think teaching your child critical thinking and to be open to ideas is the same as telling them which ones are right."
"Yeah man, I was howling with laughter in Schindlers List!",1,worldnews,It is a movie. It is a hollywood movie. Watch No End In Sight if you want to watch a documentary. Anyone who takes movies seriously aren't very bright. It is suppose to be entertainment yo!
thank you for the optimism,1,ApocalypseRising,let's face it apoc is fucked.
That chick is hot,1,hearthstone,Who needs skill when you have RNG?
"Yep, that's what happens when you turn on the A/C in the Volcano Fortress.",1,MensRights,God damn the Patriarchy is good. They can control the weather in order to oppress women.
Yeah and Nacht hinted at Revelations,1,CODZombies,World at war was hinting the whole time
You forgot the,1,politics,"Salmon and Nicola Sturgeon have to be some of my favorite politicians. I don't understand how they can be so level headed, intelligent and seemingly well intentioned."
How constitutional of him!,1,GamerGhazi,Trump: Ginsburg is 'disgrace' to Supreme Court
Nice try Obama.,1,Android,"Just an FYI, this will NOT be disabling the API for third party apps (that comply with the new TOS), and if you enjoy the app you're using, you shouldn't worry about losing access to it."
"WITH THAT MUSLIM SOCIALIST O-BAMA IN OFFICE, WE'RE GOING TO HAVE TO GIVE UP OUR MONEY AND GUNS ANYWAY!",1,AskReddit,"Yeah, but you still have to give up all your money and guns"
The pentagon needs to hire you asap,1,AskReddit,"Why doesn't someone use covert ops to convince/trick N. Korea into going to war in the Middle East? Those two seem to really like violence, they could just fuck each other silly and be too tired to have a go with the rest of the world. Not sure how one would go about doing this, though, since the Middle East and Korea don't hold much strategic value for one another. Maybe make videos of fat guys in turbans eating lots of food and making fun of the late Kim Jong-Il's sunglasses to piss off North Korea, and maybe make an Asian director's cut version of Innocence of Muslims that pokes fun at the Holocaust and include a scene where drunk Israeli rocket teams keep missing their targets and hitting residential areas instead; that's sure to bring out the fanatic in everyone over there. Foolproof?"
Because the NFL is the most American League and unions are for commie Canadian bastards,1,nfl,Why is/was the NFLPA so weak compared to unions for other leagues?
But don't you know people have places to be and don't have time to leave early enough to get there in a safe manor?,1,ProtectAndServe,"Or, you know, drive the speed limit"
"So, now she's stealing her campaign rhetoric from Trump?",1,politics,"Keep in mind that Hillary has many positions that haven't been fully detailed, but she assures us they are all the best and we will all love them."
"Maybe they mistakenly thought the little girl, sleeping on the couch, was a dog and they feared for their lives.",1,politics,"Sigh... This on top of that video posted a few weeks ago where a swat team stormed a suburban house who had two small children sleeping inside, they fire off there mp5s killing two dogs and arresting the dad. All and in all they came out with a pipe that had some pot resin in it. Who ARE THE TERRORISTS?"
Yeah let's not talk about the most important marvel match of the year.,1,MvC3,Thanks for telling me the winner.
Yeah Hitler really was a swell dude.,1,politics,"The Japanese were tolerant of Slavs and Jews, and Hitler treated black Germans as well as Roosevelt did. He even tried to support he creation of Israel."
"me too, my hubby played it first, and even when he played the game in another room, I could still listen to the dialog so I ended up knowing a few important details such as [fiora dying, fiora comming back, and dickson is a backstabbing jerk]",1,Xenoblade_Chronicles,"Definitely. I had like 50% of the game spoiled before I first played it, it was still an awesome experience."
making irc channel's require mass programming talent.,1,RotMG,"Shaitan's IRC? Is there one? I think it would be a cool idea to form an irc for people who are hunting down realm closes specifically for Shaitan's, because it is much easier to clear all the statues and do the dungeon with a group. I'd be willing to figure it out if I had to but if someone has more experience with irc and is interested I would appreciate it. I want to be a part of the UT skull club."
You mean white Christian alt-right Trump supporter.,1,The_Donald,BREAKING: Cascade mall shooter's house being raided right now (He is a muslim &amp; a Hillary supporter)
I'll let RecAP know they all have nothing to worry about then.,1,AdviceAnimals,Many people regrow their foreskin. It's totally a thing.
lowkey he probably wants to make himself readily available for king papey,1,CoDCompetitive,"They probably offered him a higher wage as a sub than dT starter, since Luminosity as an org is much larger than dT I'm sure they can afford it."
sorry looks like I'll have to tell Monstercat to become less popular,1,Monstercat,Why does this subreddit have more followers than NCS?
"no you're crazy its solely because marth beats fox, M2K isn't that good anyways",1,smashbros,"I also feel that maybe, just maybe, Mew2king does so well because he's a top 5 player. The guys comment before is rather confusing"
"Yes, but is it articulated?",1,knitting,"What do you think, new group project for this sub?"
"Oh yeah Google, another very reliable source.",1,todayilearned,"Ughhhh try google, it's very simple."
"Yes, that is exactly what I'm saying",1,pics,So it's OK occasionally if it's by your side then?
ha ha kids singing about something they dont understand ha ha ha so funny ha ha,1,funny,Childrens choir sings 'Still Alive' from Portal
#so brave,1,Android,The patent system really needs to be updated.
OH WELL THATS PROOF THEN.,1,politics,Life long democrat here. Voted gore in 2000. Kerry 2004. Obama for the last two. Never voting dem again
"Almost as much of a burden as having to ""Press 1 for English.""",1,childfree,"I honestly have no clue as to why this would bother you. It's not uncommon for parents to buy subscriptions for their children. Netflix is not just for adults. With all of the adult content on the adult netflix, it makes sense to offer a kids selection. You should be more selective with your battles. Also, it takes up 2 seconds of your life."
Dang they are SO GOOD nope totally not win trading.,1,ClashRoyale,Speaks for it's self -.-
"Oh, that's right, Trump is the warhawk.",1,politics,"""Trump asked three times in an hour briefing: 'why can't we use nuclear weapons?'"""
"Oh c'mon, the farm house has the never ending shotgun!",1,thewalkingdead,Yeah I agree. I sort of thought it was a done deal by the end of the season.I don't mind Alexandria tbh. As logn as it's not Hershels farm house..
Blue shirt must mean you're a manager.,1,AskReddit,"I work at a store with a blue polo and khaki pants uniform. I can't wear it anywhere, even to stores that have a different uniform. I went into Ulta, where the people who work there wear all black, and I heard two women talking in the same aisle I was on. One said, ""Where is the dry shampoo?"" My next stop is on a shampoo aisle. I didn't realize they had followed me until one whispered loudly to the other, ""I think she's looking for it."" I turned to them and told them I didn't work there and they should find someone wearing black. I stopped at a truckstop on my way to work to get some food from the fast food restaurant attached to it. Everyone there wears maroon shirts. Mine is blue. As I am walking away from the counter with my food in hand, sipping on my drink, someone stops me and asks where the bathroom is. ""You'll have to ask someone who works here."" Then my store won a contest that netted us $500 for anything we wanted for the store. My boss decided to spruce up the break room. This meant going to various home stores for supplies and getting stopped in every aisle to answer questions. Motherfuckers, pay attention."
So isn't this DF admitting he had no idea of a SEE?,1,CODZombies,DF Just Sent This Video To The Mods...
Women in Burqas = Nazis,1,ShitRedditSays,"""If Germans can't wear Swastikas, then Muslims should not be allowed to wear the wahhabism equivalent of Swastikas """
Well if the poor weren't so lazy maybe they'd have more money.,1,politics,They're the party that loves freedoms they care about. Namely the freedom to take money from the poor.
"yeah, it's so black and WHITE.",1,politics,Ah yes there are only 2 possible options
look how kevin mchale cursed them,1,nba,Is it still fun to mock Houston's defense? Because this wasn't great.
"As a Greek citizen I am ready to accept, house and feed your 3k new immigrant arrivals per day.",1,europe,Greece could put them in refugee camps until the war is over. Ideally the EU would pay for those camps.
"Because Putin loves America so much, he just wants us to elect the strongest and most capable person.",1,politics,Hmm.. why is Russia so interested in seeing Comrade Trump elected president?
I bet you don't even know what coitus means.,1,iamverysmart,"If this girl is so very smart, why tf would she think Tinder is a good place to meet friends? And why would she mention being a model? Why would a friend care if you're a model or not? Or a communist atheist? This person is obviously too smart for me because I am very confused by all of this."
"Yes, because cream cheese is made of cream and cheese.",1,AskReddit,This really ought to be illegal to advertise as cream cheese. Cream and cheese are both primarily fat.
Can you drown in cotton wool?,1,Frozen,Buy a load of cotton wool and go as Olaf. I'll leave you to figure out the specifics.
"just like in california in 2010 when they voted on legalization and the all the biggest black market producing counties (the green triangle) voted 75%+ against it, and probably funded all those wonderful super PACs that just really aid our democracy and make it fair and balanced.",1,worldnews,"Watch the brave representatives die in explosions and drive by shootings instigated by Narcos. When legalization is up for a vote anywhere in South America, Narco trafficers pump money into the legalization opponents. They make a lot more money with it illegal."
but Jack in the Box seasons while they cook!,1,Austin,*ding ding ding* We have a winner!
"Yeah, but the only reason he has to interrupt is that Clinton goes over her allowed time and the Mods don't stop her",1,enoughsandersspam,As BernieBots whine and moan about interruptions it turns out he's the worst offender. He's interrupted Clinton 3X more than she's interrupted him. Bonus: O'Malley interrupted during debates more times than Clinton has despite being in less of them.
"I don't know, but whatever you do you should definitely post pics of it on Reddit.",1,bdsm,So im a virgin and in need of masturbation. I'm too tight to actually put anything inside me. All i do is rub my clit but that never gets me off.. what should I do?
But that'll destroy my engine,1,Jeep,"HP peak is supposed to be 4600ish, but yeah you need to get to at least 3-4k when you need a bunch of power, and not be scared of going all the way up to 4800 to get on the highway, especially if there's no ramp."
You're not my ex-wife are you?,1,EliteDangerous,There is also a 'caution moving part' label on a part that doesn't move. :/
Hey the SS were also uniformed so I guess they were fine too......,1,worldnews,"The idf is paid as part of a uniformed force to target military structures in a war, Israel does not pay individuals to go massacre civilians in terrorist attacks."
obviously,1,pcmasterrace,Its not like Steam has randomly gone down mid game and have the game crash.
I'm pretty sure I haven't seen anyone else suggesting this around here before,1,halo,IKR it's like other people would want this too!
But everyone knows that cardio kills gains!,1,LifeProTips,LPT: Watch your Netflix series / movies / etc. on the stationary bike or elliptical at the gym. Every hour of screen time while exercising is an easy 400 calories burned.
Ahh so good to see the liberals know what they are doing,1,politics,Chicago will face a $1.15 billion pension shortfall by 2016 without comprehensive reform by the state legislature.
Haven't you heard that GMOs are bad for you?,1,worldnews,"Genetically Modified Rice Makes More Food, Less Greenhouse Gas"
Colour me shocked,1,toronto,IT WAS A SCAM
Election kab hai Siachen mein?,1,indianews,"Narendra Modi on Twitter: ""Friends, I am leaving for Siachen Glacier. Its my good fortune that I will be able to spend time with our brave soldiers on this special day"""
But they told me he was broke and in the ropes sacre Bleu how could that have happened,1,The_Donald,TRUMP RAISES OVER $50 MILLION IN JUNE! GASP!
missed the,1,videos,"Dude did you not read the comments!? its so obvious why they didnt like it. Some guy explained it. ""The dislikes are because Americans are fed up with illegals crossing our border and ruining this country. And all this is shoved down their throats every day as ""good"". American culture is disappearing because our government is unwilling to secure the border, but instead sends your sons and daughters to fight meaningless wars in places we have no interest in. Our own president breaks our country's constitution and gives millions of criminals who cross our border citizenship, to the dismay and protest of many of his coworkers in government. Does that clear it up for you?"""
yeah those late game 300 hp every 6 secs if he is at 10% hp out of 3k hp seems op,1,leagueoflegends,"MaoKai with the fucking water dragon buff.... like, are you joking Lucas?"
And it really helps when the government gives them money for having children and being unemployed,1,The_Donald,"Odd as it sounds, some people don't want success. They want to be helpless and weak and have life handled for them."
"Dude, wow, I even forgot that Detroit was in the rotation, I thought it was Comeback only.",1,OpTicGaming,I have not seen a single Detroit Uplink this event.
"Yeah, because it's only the gamergate side who doxx....",1,quityourbullshit,"Careful, you might get doxxed in the name of ethical journalism in gaming! Because before this whole hoopla everyone knew that it was a bastion of transparency!"
I wonder if the owners ever do psychedelic drugs?,1,gaming,The bathroom of a Swedish gaming store
I didn't know Islam was a nationality,1,worldnews,"Ask these lunatics and they will tell you they are simply muslim, not Norwegian."
"And because he's sent more than three, at least two of them MUST have worked!",1,creepyPMs,The Naked Man. Works 2 out of 3 times every time.
Because men don't taste as good.,1,TheRedPill,"Why The Pursuit of Women? Have you ever stopped and asked yourself why you put women in a pedestal and why you pursue them so much? Pro 1: You can get company for a while. Pro 2: You can experience sex. Pro 3: You might feel better with yourself. Pro 1 can be achieved through lots of different means not necessarily requiring women, or said better: not necessarily having to be in a 'relationship' with women. As the internet and other technology advances there will be more and more ways to be in company of other people. And I don't mean strictly virtually, more and more real life options will open. If you train yourself to only be happy in the company of women, you will end up having your women 'life partner' which will very probably make you miserable. Relationships between a man and a women deteriorate and become a chore. It removes your happiness and freedom just to comply with some social role. When you could have just have lots of good friends and hang with them when you want. Pro 2, yeah sex is good I guess, but doesn't it very often lead to pregnancy, isn't the sex drive just a mechanism to perpetuate the species? Think about all the unwanted pregnancies that happened because someone was horny and in pursuit of sex. Once it happens you are responsible for the kid and the mom, you are stuck to having to interact and support a woman you might despise for the rest of your life. Also you could impregnate an ugly or terrible women, and will bring ugly kids to the world raised by a terrible mom. But to be fair, reproduction is not really a bad thing, your choice if you want to be a designated breeder. Pro 3 might be just a simple social construct, you were raised to think you were meant to chase women, have sex, spend a lot of your time with them, be a man. It can easily be altered if you think about it in a certain way, and you wont care about it again, thus not being a problem anymore."
"Yeah, women's suffrage was just a fad anyways.",1,AskReddit,Man Buns and women's rights
"I don't know about y'all, but I think it's kind of neat how Chinese numerology and Feng Shui anticipated the changeover from the traditional Chinese lunar calender to the modern Gergorian calender so that this stuff still works.",1,skeptic,"Got this email from my grandpa This is interesting and just for fun... Chinese numerology and Feng Shui for 2011 This year we are going to experience four unusual dates: 1/1/11, 1/11/11, 11/1/11, 11/11/11, and that's not all; Take the last two digits of the year you were born and the age you will be this year and the result will add up to 111 for everyone!!!! This is the year of MONEY. Also, this year, October will have 5 Sundays, 5 Mondays &amp; 5 Saturdays. This happens only once every 823 years. These particular years are known as Moneybag years. The proverb goes that if you send this to eight good friends, money will appear in the next four days, as is explained in the Chinese feng shui. Those who don't continue the chain, won't receive. It's a mystery, but it's worth a try. Good luck to you. This only happens once in 800 years."
You had to google it to find out Buzzfeed is trash?,1,politics,My quick google found thousands of references to Russia allegorically linked to a bear waking from hibernation. Buzzfeed is trash.
"Sure they are, just ask them.",1,GetMotivated,"I disagree. Working hard is key but not everyone is creative or talented, that's a huge stretch."
Can't wait for him to do an AMA,1,movies,Woody Harrelson to Play Villain in New 'Planet of the Apes' Movie
Meme talent ?,1,osugame,Am I missing something?
"He's eligible for the Selective Service draft as of 3 years ago... but all 20 somethings have an iffy history with the law, so it's all good.",1,nfl,I think it's a little early to say a 21 year old is a garbage person.
Looks like it fell off a Subaru of some sort.,1,subaru,What did this fall off of? What is it?
"No no, not 10-4, I'm pretty sure this clock goes all the way to 12.",1,discgolf,Ahh..haha. 10-4.
we also eat dead babies and worship satan daily.,1,Libertarian,"The hive-mind of 4chan also watches child porn, is racist, and is sexist."
Finn's dad is Lando Calrissian whose dad is Mace Windu who is the brother of Captain Panaka.,1,StarWarsLeaks,Hoping that Finn says this when seeing Luke...
But guns are dangerous mass murder machines!,1,news,"Good. If they're already licensed for carry then they should be allowed to carry on campus. As a group, carry permit holders are extremely law abiding as is, not allowing licensed carry on campus is nothing more than a publicity stunt to protect feels."
Yeah its amazing the company has even survived this long,1,Overwatch,"There should be something. Maybe not this, maybe not even anything I can conceive but there needs to be something because the way Blizzard has done beta invites for the past 15+ years has never worked."
"Nah, it's gotta go on at least 500 more posts.",1,RoastMe,I think this joke is getting old
Because that's how pros play ofcourse ^,1,GlobalOffensive,why
But then you are wasting your vote and betraying the democrazy!,1,ImGoingToHellForThis,It's always between a Giant Douche and a Turd Sandwich though
"If you're being sarcastic, you gotta let people know......",1,WTF,That's why woman shouldn't be driving in this world
"Yes, you're a terrible person for being honest and knowing yourself.",1,casualiama,Yeah... i am a horrible person i guess?? Wtf i said i am not comfortable around disabled people not that i dont like them.. You try being around someone who constantly breaks down in a tantrum and wont respond to you. Its fucking awkward and i am not trained on how to act. I wont apologize for not having the skills my aunt went to college for.
Sounds like someone drank a bottle of haterade today!,1,niceguys,"He's only being a little passive aggressive, but at least he isn't a Chad. What a keeper x)"
"Yes, it'd be much better if the NYTimes, with their new newsletter on race, omitted Asians entirely.",1,asianamerican,"Probably because it means that it paints a target on your back and while I can understand the negatives of being put in the spotlight, it doesn't work in America or white-centric culture."
That's what you get for not being super edgy like the rest of them.,1,AskReddit,I suggested that killing all Muslims might not be a great idea after another comment suggested it. -40 votes.
"Yeah, real secret.",1,Conservative,Apple CEO Tim Cook attends secret meeting with tech and government elite to plot end to Trump presidential run
"I heard they were able to strike lightning on us, hence their logo",1,singapore,a dangerous attempt by the ruling party to spy on us. we must tread carefully
It's ok as long as the person/company you are taking from is rich.,1,news,"Holy false equivalence, Batman! Are you comparing a poor busker to billion dollar companies like Universal? That's what you're hanging your hat on? Really?"
Some real oppression happening in Catalunya right now...,1,europe,I'm sorry for Portugal but I am happy that the government that oppresses Catalonia is being fined.
"Nah, he deleted that tweet so he never said that",1,hillaryclinton,YOU LITERALLY SAID THAT CLIMATE CHANGE IS A HOAX.
So that people don't think she's a she?,1,40kLore,"Yeah, don't even ask. I can't think of a roleplay-worthy reason why a female Water Caste would call herself a space marine."
"Ya, why doesn't he just give you the source code he's been working on for months?",1,Multicopter,"ugh closed beta i dont want to share my email and shit. just give me a closed beta code and i'll test the thing out. or hell, let me host it on my own apache server or something to use it."
"My parents are Hindus, you intolerant shitlord!",1,Incels,"And i'm the four handed elephant god of beginnings Ganesha yet chicks lower than a 5 reject me. Damn deluded bitchez i tell you! Can't show a pic though, that would ruin my reputation at the pantheon of hindu gods."
Systematic and legal harvesting of human organs...NO BIG DEAL GUYS.,1,governmentoppression,Expedited FOIA request in Planned Parenthood scandal rejected over lack of newsworthiness
You dropped this,1,funny,I 'member! 'Member the vastly superior Disney version of Doug?
Your dropped this,1,leagueoflegends,Nah it's cuz he's black
I'm shocked to learn that the hash tag campaign on Twitter didn't free the kidnapped girls or bring Boko Haram to its knees.,1,worldnews,"Human Rights Watch: Boko Haram kills 2,053 over the course of 6 months and the girls kidnapped in April are still missing and most likely scattered, in case anyone forgot"
Razer Kraken can be found at Virgin,1,dubai,"""i think"" i saw one in unimart in ajman behind china mall. off topic but searching liquors related: anyone knows how much kracken is and where will i get it locally?"
The creepiest part is the fact that he puts a space before each comma.,1,creepyPMs,Old friend from HS asked for my number. We start texting one day just catching up on normal life stuff. Didnt hear from him for about a week and then BAM! Sends me a random picture of his junk and then immediately follows it with all these texts....cr3333p
*tips Pharis' hat* m'undead Le gems to you my scholar and gentledude xD,1,darksouls,"To the man in the crystal armor... I am quite sorry that your victory over me was sfort as my poison killed you, but good fight my good sir."
Nah i'd honestly switch out the 2 980ti's for an R9 390,1,pcmasterrace,thats 2 980ti's. If you sell it on lounge
The well trained and completely professional security staff at the airport.,1,reddit.com,"What's to stop a terrorist from setting off a bomb while in a huge security line at the airport? A huge line, tons of people close to one another, what protection do we have?"
